{
  "board_package": 1,
  "id": "relay4-button",
  "name": "Four relays and a button (example)",
  "mcu": "esp32-devkit",
  "terminals": {
    "OUT1": {
      "pin": 23
    },
    "OUT2": {
      "pin": 22
    },
    "OUT3": {
      "pin": 21
    },
    "OUT4": {
      "pin": 19
    },
    "TRIG1": {
      "pin": 36,
      "active": "low",
      "pull": "board"
    },
    "TRIG2": {
      "pin": 18,
      "active": "high",
      "pull": "board"
    }
  },
  "analog": 39,
  "status_led": 2
}
