{"board_package":1,"id":"relay-board","name":"Relay board","mcu":"esp32-devkit","terminals":{"OUT1":{"pin":23},"OUT2":{"pin":22},"OUT3":{"pin":21},"OUT4":{"pin":19},"TRIG1":{"pin":36,"active":"low","pull":"board"},"TRIG2":{"pin":18,"active":"high","pull":"board"}},"status_led":2,"defaults":{"settings":{"name":"Relay7","cooldown_ms":0},"profile":{"aliases":[{"alias":"LAMP","terminal":"OUT1"}]},"script":"effect blink:\n  wait for trig2\n  lamp = on\n  sleep 1\n  lamp = off\n"}}
